[
  { "id": "qa-001", "clientId": "client-1", "audience": "staff", "actionType": "approve_item", "title": "Согласовать перевод $50,000", "description": "Wire transfer требует подтверждения", "icon": "CheckCircle", "deepLink": "/m/tasks/item/task-001", "severity": "high", "sourceType": "task", "sourceId": "task-001", "priority": 90, "status": "active", "createdAt": "2025-01-15T10:00:00Z" },
  { "id": "qa-002", "clientId": "client-1", "audience": "staff", "actionType": "view_risk_alert", "title": "Tech Concentration Alert", "description": "Превышен лимит концентрации", "icon": "AlertTriangle", "deepLink": "/m/risk/item/alert-001", "severity": "critical", "sourceType": "riskAlert", "sourceId": "alert-001", "priority": 95, "status": "active", "createdAt": "2025-01-15T09:30:00Z" },
  { "id": "qa-003", "clientId": "client-2", "audience": "client", "actionType": "open_report", "title": "Просмотреть Q4 отчет", "description": "Квартальный отчет готов", "icon": "FileText", "deepLink": "/portal/reports/rep-001", "severity": "low", "sourceType": "report", "sourceId": "rep-001", "priority": 50, "status": "active", "createdAt": "2025-01-14T15:00:00Z" },
  { "id": "qa-004", "clientId": "client-3", "audience": "staff", "actionType": "approve_item", "title": "Rebalancing approval", "description": "Срочно: deadline сегодня", "icon": "Clock", "deepLink": "/m/tasks/item/task-002", "severity": "critical", "sourceType": "task", "sourceId": "task-002", "priority": 98, "status": "active", "createdAt": "2025-01-15T07:00:00Z" },
  { "id": "qa-005", "clientId": "client-4", "audience": "client", "actionType": "open_thread", "title": "Сообщение от advisor", "description": "Новое сообщение", "icon": "MessageSquare", "deepLink": "/portal/messages/thr-001", "severity": "medium", "sourceType": "thread", "sourceId": "thr-001", "priority": 60, "status": "active", "createdAt": "2025-01-15T06:00:00Z" },
  { "id": "qa-006", "clientId": "client-5", "audience": "staff", "actionType": "open_task", "title": "Просроченная задача: IPS", "description": "Просрочено на 2 дня", "icon": "AlertCircle", "deepLink": "/m/tasks/item/task-003", "severity": "high", "sourceType": "task", "sourceId": "task-003", "priority": 85, "status": "active", "createdAt": "2025-01-15T05:00:00Z" },
  { "id": "qa-007", "clientId": "client-5", "audience": "staff", "actionType": "view_risk_alert", "title": "Volatility Alert", "description": "Портфель превысил target volatility", "icon": "TrendingUp", "deepLink": "/m/risk/item/alert-002", "severity": "high", "sourceType": "riskAlert", "sourceId": "alert-002", "priority": 80, "status": "completed", "createdAt": "2025-01-14T09:00:00Z" },
  { "id": "qa-008", "clientId": "client-6", "audience": "client", "actionType": "view_document", "title": "Подписать IPS", "description": "Обновленный документ", "icon": "Edit3", "deepLink": "/portal/documents/ips-001", "severity": "medium", "sourceType": "document", "sourceId": "ips-001", "priority": 65, "status": "active", "createdAt": "2025-01-13T16:00:00Z" },
  { "id": "qa-009", "clientId": "client-7", "audience": "client", "actionType": "pay_invoice", "title": "Оплатить счет", "description": "Счет $1,800 за Q4", "icon": "CreditCard", "deepLink": "/portal/fees/inv-002", "severity": "medium", "sourceType": "invoice", "sourceId": "inv-002", "priority": 55, "status": "completed", "createdAt": "2025-01-12T11:00:00Z" },
  { "id": "qa-010", "clientId": "client-8", "audience": "staff", "actionType": "open_task", "title": "KYC напоминание", "description": "Deadline 20 января", "icon": "UserCheck", "deepLink": "/m/onboarding/item/case-001", "severity": "high", "sourceType": "task", "sourceId": "task-kyc", "priority": 75, "status": "active", "createdAt": "2025-01-15T04:00:00Z" },
  { "id": "qa-011", "clientId": "client-8", "audience": "staff", "actionType": "view_risk_alert", "title": "Security Alert", "description": "Новое устройство", "icon": "Shield", "deepLink": "/m/security/devices", "severity": "critical", "sourceType": "securityAlert", "sourceId": "sec-001", "priority": 92, "status": "active", "createdAt": "2025-01-14T23:00:00Z" },
  { "id": "qa-012", "clientId": "client-1", "audience": "client", "actionType": "view_document", "title": "Подписать Amendment", "description": "Ожидает подписи", "icon": "FileSignature", "deepLink": "/portal/documents/doc-002", "severity": "high", "sourceType": "document", "sourceId": "doc-002", "priority": 70, "status": "active", "createdAt": "2025-01-15T11:00:00Z" },
  { "id": "qa-013", "clientId": "client-2", "audience": "client", "actionType": "open_report", "title": "Performance Report", "description": "Еженедельный отчет", "icon": "BarChart2", "deepLink": "/portal/reports/rep-003", "severity": "low", "sourceType": "report", "sourceId": "rep-003", "priority": 40, "status": "active", "createdAt": "2025-01-15T07:30:00Z" },
  { "id": "qa-014", "clientId": "client-3", "audience": "client", "actionType": "pay_invoice", "title": "Оплатить счет", "description": "Reminder: INV-2024-089", "icon": "DollarSign", "deepLink": "/portal/fees/inv-003", "severity": "medium", "sourceType": "invoice", "sourceId": "inv-003", "priority": 55, "status": "active", "createdAt": "2025-01-14T08:00:00Z" },
  { "id": "qa-015", "clientId": "client-4", "audience": "staff", "actionType": "open_task", "title": "Review Q1 Goals", "description": "Задача назначена", "icon": "Target", "deepLink": "/m/tasks/item/task-005", "severity": "medium", "sourceType": "task", "sourceId": "task-005", "priority": 50, "status": "completed", "createdAt": "2025-01-13T09:00:00Z" },
  { "id": "qa-016", "clientId": "client-6", "audience": "staff", "actionType": "approve_item", "title": "Benchmark Change", "description": "Запрос на изменение", "icon": "RefreshCw", "deepLink": "/m/ips/item/ips-002", "severity": "medium", "sourceType": "ips", "sourceId": "ips-002", "priority": 60, "status": "active", "createdAt": "2025-01-15T08:30:00Z" },
  { "id": "qa-017", "clientId": "client-8", "audience": "staff", "actionType": "view_risk_alert", "title": "Liquidity Warning", "description": "Ниже target level", "icon": "Droplet", "deepLink": "/m/risk/item/alert-003", "severity": "high", "sourceType": "riskAlert", "sourceId": "alert-003", "priority": 78, "status": "active", "createdAt": "2025-01-14T16:00:00Z" },
  { "id": "qa-018", "clientId": "client-2", "audience": "client", "actionType": "open_thread", "title": "Ответить advisor", "description": "Ожидается ответ", "icon": "Reply", "deepLink": "/portal/messages/thr-005", "severity": "high", "sourceType": "thread", "sourceId": "thr-005", "priority": 72, "status": "active", "createdAt": "2025-01-15T08:45:00Z" },
  { "id": "qa-019", "clientId": "client-3", "audience": "client", "actionType": "open_report", "title": "Annual Report 2024", "description": "Готов к просмотру", "icon": "BookOpen", "deepLink": "/portal/reports/rep-004", "severity": "low", "sourceType": "report", "sourceId": "rep-004", "priority": 35, "status": "active", "createdAt": "2025-01-08T10:00:00Z" },
  { "id": "qa-020", "clientId": "client-5", "audience": "client", "actionType": "pay_invoice", "title": "Payment Due", "description": "Срок через 3 дня", "icon": "Calendar", "deepLink": "/portal/fees/inv-004", "severity": "medium", "sourceType": "invoice", "sourceId": "inv-004", "priority": 58, "status": "active", "createdAt": "2025-01-15T03:00:00Z" },
  { "id": "qa-021", "clientId": "client-1", "audience": "staff", "actionType": "view_risk_alert", "title": "Rebalancing Needed", "description": "5% deviation", "icon": "PieChart", "deepLink": "/m/risk/item/alert-004", "severity": "high", "sourceType": "riskAlert", "sourceId": "alert-004", "priority": 76, "status": "completed", "createdAt": "2025-01-04T10:00:00Z" },
  { "id": "qa-022", "clientId": "client-2", "audience": "staff", "actionType": "view_risk_alert", "title": "Currency Risk EUR", "description": "Повышенный риск", "icon": "Globe", "deepLink": "/m/risk/currency", "severity": "high", "sourceType": "riskAlert", "sourceId": "alert-currency", "priority": 74, "status": "active", "createdAt": "2025-01-15T09:15:00Z" },
  { "id": "qa-023", "clientId": "client-3", "audience": "staff", "actionType": "open_thread", "title": "Compliance Update", "description": "Важное сообщение", "icon": "Shield", "deepLink": "/m/comms/thread/thr-006", "severity": "high", "sourceType": "thread", "sourceId": "thr-006", "priority": 73, "status": "active", "createdAt": "2025-01-15T08:00:00Z" },
  { "id": "qa-024", "clientId": "client-1", "audience": "client", "actionType": "view_document", "title": "Signature Reminder", "description": "До 20 января", "icon": "PenTool", "deepLink": "/portal/documents/doc-005", "severity": "high", "sourceType": "document", "sourceId": "doc-005", "priority": 71, "status": "active", "createdAt": "2025-01-15T10:30:00Z" }
]
